ID,TITLE,ABSTRACT,Computer Science,Physics,Mathematics,Statistics,Quantitative Biology,Quantitative Finance
1,Reconstructing Subject-Specific Effect Maps,"  Predictive models allow subject-specific inference when analyzing disease
related alterations in neuroimaging data. Given a subject's data, inference can
be made at two levels: global, i.e. identifiying condition presence for the
subject, and local, i.e. detecting condition effect on each individual
measurement extracted from the subject's data. While global inference is widely
used, local inference, which can be used to form subject-specific effect maps,
is rarely used because existing models often yield noisy detections composed of
dispersed isolated islands. In this article, we propose a reconstruction
method, named RSM, to improve subject-specific detections of predictive
modeling approaches and in particular, binary classifiers. RSM specifically
aims to reduce noise due to sampling error associated with using a finite
sample of examples to train classifiers. The proposed method is a wrapper-type
algorithm that can be used with different binary classifiers in a diagnostic
manner, i.e. without information on condition presence. Reconstruction is posed
as a Maximum-A-Posteriori problem with a prior model whose parameters are
estimated from training data in a classifier-specific fashion. Experimental
evaluation is performed on synthetically generated data and data from the
Alzheimer's Disease Neuroimaging Initiative (ADNI) database. Results on
synthetic data demonstrate that using RSM yields higher detection accuracy
compared to using models directly or with bootstrap averaging. Analyses on the
ADNI dataset show that RSM can also improve correlation between
subject-specific detections in cortical thickness data and non-imaging markers
of Alzheimer's Disease (AD), such as the Mini Mental State Examination Score
and Cerebrospinal Fluid amyloid-$\beta$ levels. Further reliability studies on
the longitudinal ADNI dataset show improvement on detection reliability when
RSM is used.
",1,0,0,0,0,0
2,Rotation Invariance Neural Network,"  Rotation invariance and translation invariance have great values in image
recognition tasks. In this paper, we bring a new architecture in convolutional
neural network (CNN) named cyclic convolutional layer to achieve rotation
invariance in 2-D symbol recognition. We can also get the position and
orientation of the 2-D symbol by the network to achieve detection purpose for
multiple non-overlap target. Last but not least, this architecture can achieve
one-shot learning in some cases using those invariance.
",1,0,0,0,0,0
3,Spherical polyharmonics and Poisson kernels for polyharmonic functions,"  We introduce and develop the notion of spherical polyharmonics, which are a
natural generalisation of spherical harmonics. In particular we study the
theory of zonal polyharmonics, which allows us, analogously to zonal harmonics,
to construct Poisson kernels for polyharmonic functions on the union of rotated
balls. We find the representation of Poisson kernels and zonal polyharmonics in
terms of the Gegenbauer polynomials. We show the connection between the
classical Poisson kernel for harmonic functions on the ball, Poisson kernels
for polyharmonic functions on the union of rotated balls, and the Cauchy-Hua
kernel for holomorphic functions on the Lie ball.
",0,0,1,0,0,0
4,A finite element approximation for the stochastic Maxwell--Landau--Lifshitz--Gilbert system,"  The stochastic Landau--Lifshitz--Gilbert (LLG) equation coupled with the
Maxwell equations (the so called stochastic MLLG system) describes the creation
of domain walls and vortices (fundamental objects for the novel nanostructured
magnetic memories). We first reformulate the stochastic LLG equation into an
equation with time-differentiable solutions. We then propose a convergent
$\theta$-linear scheme to approximate the solutions of the reformulated system.
As a consequence, we prove convergence of the approximate solutions, with no or
minor conditions on time and space steps (depending on the value of $\theta$).
Hence, we prove the existence of weak martingale solutions of the stochastic
MLLG system. Numerical results are presented to show applicability of the
method.
",0,0,1,0,0,0
5,Comparative study of Discrete Wavelet Transforms and Wavelet Tensor Train decomposition to feature extraction of FTIR data of medicinal plants,"  Fourier-transform infra-red (FTIR) spectra of samples from 7 plant species
were used to explore the influence of preprocessing and feature extraction on
efficiency of machine learning algorithms. Wavelet Tensor Train (WTT) and
Discrete Wavelet Transforms (DWT) were compared as feature extraction
techniques for FTIR data of medicinal plants. Various combinations of signal
processing steps showed different behavior when applied to classification and
clustering tasks. Best results for WTT and DWT found through grid search were
similar, significantly improving quality of clustering as well as
classification accuracy for tuned logistic regression in comparison to original
spectra. Unlike DWT, WTT has only one parameter to be tuned (rank), making it a
more versatile and easier to use as a data processing tool in various signal
processing applications.
",1,0,0,1,0,0
6,On maximizing the fundamental frequency of the complement of an obstacle,"  Let $\Omega \subset \mathbb{R}^n$ be a bounded domain satisfying a
Hayman-type asymmetry condition, and let $ D $ be an arbitrary bounded domain
referred to as ""obstacle"". We are interested in the behaviour of the first
Dirichlet eigenvalue $ \lambda_1(\Omega \setminus (x+D)) $. First, we prove an
upper bound on $ \lambda_1(\Omega \setminus (x+D)) $ in terms of the distance
of the set $ x+D $ to the set of maximum points $ x_0 $ of the first Dirichlet
ground state $ \phi_{\lambda_1} > 0 $ of $ \Omega $. In short, a direct
corollary is that if \begin{equation} \mu_\Omega := \max_{x}\lambda_1(\Omega
\setminus (x+D)) \end{equation} is large enough in terms of $ \lambda_1(\Omega)
$, then all maximizer sets $ x+D $ of $ \mu_\Omega $ are close to each maximum
point $ x_0 $ of $ \phi_{\lambda_1} $.
Second, we discuss the distribution of $ \phi_{\lambda_1(\Omega)} $ and the
possibility to inscribe wavelength balls at a given point in $ \Omega $.
Finally, we specify our observations to convex obstacles $ D $ and show that
if $ \mu_\Omega $ is sufficiently large with respect to $ \lambda_1(\Omega) $,
then all maximizers $ x+D $ of $ \mu_\Omega $ contain all maximum points $ x_0
$ of $ \phi_{\lambda_1(\Omega)} $.
",0,0,1,0,0,0
7,On the rotation period and shape of the hyperbolic asteroid 1I/`Oumuamua (2017) U1 from its lightcurve,"  We observed the newly discovered hyperbolic minor planet 1I/`Oumuamua (2017
U1) on 2017 October 30 with Lowell Observatory's 4.3-m Discovery Channel
Telescope. From these observations, we derived a partial lightcurve with
peak-to-trough amplitude of at least 1.2 mag. This lightcurve segment rules out
rotation periods less than 3 hr and suggests that the period is at least 5 hr.
On the assumption that the variability is due to a changing cross section, the
axial ratio is at least 3:1. We saw no evidence for a coma or tail in either
individual images or in a stacked image having an equivalent exposure time of
9000 s.
",0,1,0,0,0,0
8,Adverse effects of polymer coating on heat transport at solid-liquid interface,"  The ability of metallic nanoparticles to supply heat to a liquid environment
under exposure to an external optical field has attracted growing interest for
biomedical applications. Controlling the thermal transport properties at a
solid-liquid interface then appears to be particularly relevant. In this work,
we address the thermal transport between water and a gold surface coated by a
polymer layer. Using molecular dynamics simulations, we demonstrate that
increasing the polymer density displaces the domain resisting to the heat flow,
while it doesn't affect the final amount of thermal energy released in the
liquid. This unexpected behavior results from a trade-off established by the
increasing polymer density which couples more efficiently with the solid but
initiates a counterbalancing resistance with the liquid.
",0,1,0,0,0,0
9,"SPH calculations of Mars-scale collisions: the role of the Equation of State, material rheologies, and numerical effects","  We model large-scale ($\approx$2000km) impacts on a Mars-like planet using a
Smoothed Particle Hydrodynamics code. The effects of material strength and of
using different Equations of State on the post-impact material and temperature
distributions are investigated. The properties of the ejected material in terms
of escaping and disc mass are analysed as well. We also study potential
numerical effects in the context of density discontinuities and rigid body
rotation. We find that in the large-scale collision regime considered here
(with impact velocities of 4km/s), the effect of material strength is
substantial for the post-impact distribution of the temperature and the
impactor material, while the influence of the Equation of State is more subtle
and present only at very high temperatures.
",0,1,0,0,0,0
10,$\mathcal{R}_{0}$ fails to predict the outbreak potential in the presence of natural-boosting immunity,"  Time varying susceptibility of host at individual level due to waning and
boosting immunity is known to induce rich long-term behavior of disease
transmission dynamics. Meanwhile, the impact of the time varying heterogeneity
of host susceptibility on the shot-term behavior of epidemics is not
well-studied, even though the large amount of the available epidemiological
data are the short-term epidemics. Here we constructed a parsimonious
mathematical model describing the short-term transmission dynamics taking into
account natural-boosting immunity by reinfection, and obtained the explicit
solution for our model. We found that our system show ""the delayed epidemic"",
the epidemic takes off after negative slope of the epidemic curve at the
initial phase of epidemic, in addition to the common classification in the
standard SIR model, i.e., ""no epidemic"" as $\mathcal{R}_{0}\leq1$ or normal
epidemic as $\mathcal{R}_{0}>1$. Employing the explicit solution we derived the
condition for each classification.
",0,0,0,0,1,0
11,A global sensitivity analysis and reduced order models for hydraulically-fractured horizontal wells,"  We present a systematic global sensitivity analysis using the Sobol method
which can be utilized to rank the variables that affect two quantity of
interests -- pore pressure depletion and stress change -- around a
hydraulically-fractured horizontal well based on their degree of importance.
These variables include rock properties and stimulation design variables. A
fully-coupled poroelastic hydraulic fracture model is used to account for pore
pressure and stress changes due to production. To ease the computational cost
of a simulator, we also provide reduced order models (ROMs), which can be used
to replace the complex numerical model with a rather simple analytical model,
for calculating the pore pressure and stresses at different locations around
hydraulic fractures. The main findings of this research are: (i) mobility,
production pressure, and fracture half-length are the main contributors to the
changes in the quantities of interest. The percentage of the contribution of
each parameter depends on the location with respect to pre-existing hydraulic
fractures and the quantity of interest. (ii) As the time progresses, the effect
of mobility decreases and the effect of production pressure increases. (iii)
These two variables are also dominant for horizontal stresses at large
distances from hydraulic fractures. (iv) At zones close to hydraulic fracture
tips or inside the spacing area, other parameters such as fracture spacing and
half-length are the dominant factors that affect the minimum horizontal stress.
The results of this study will provide useful guidelines for the stimulation
design of legacy wells and secondary operations such as refracturing and infill
drilling.
",1,0,0,0,0,0
12,Role-separating ordering in social dilemmas controlled by topological frustration,"  ""Three is a crowd"" is an old proverb that applies as much to social
interactions, as it does to frustrated configurations in statistical physics
models. Accordingly, social relations within a triangle deserve special
attention. With this motivation, we explore the impact of topological
frustration on the evolutionary dynamics of the snowdrift game on a triangular
lattice. This topology provides an irreconcilable frustration, which prevents
anti-coordination of competing strategies that would be needed for an optimal
outcome of the game. By using different strategy updating protocols, we observe
complex spatial patterns in dependence on payoff values that are reminiscent to
a honeycomb-like organization, which helps to minimize the negative consequence
of the topological frustration. We relate the emergence of these patterns to
the microscopic dynamics of the evolutionary process, both by means of
mean-field approximations and Monte Carlo simulations. For comparison, we also
consider the same evolutionary dynamics on the square lattice, where of course
the topological frustration is absent. However, with the deletion of diagonal
links of the triangular lattice, we can gradually bridge the gap to the square
lattice. Interestingly, in this case the level of cooperation in the system is
a direct indicator of the level of topological frustration, thus providing a
method to determine frustration levels in an arbitrary interaction network.
",0,1,0,0,0,0
13,Dynamics of exciton magnetic polarons in CdMnSe/CdMgSe quantum wells: the effect of self-localization,"  We study the exciton magnetic polaron (EMP) formation in (Cd,Mn)Se/(Cd,Mg)Se
diluted-magnetic-semiconductor quantum wells using time-resolved
photoluminescence (PL). The magnetic field and temperature dependencies of this
dynamics allow us to separate the non-magnetic and magnetic contributions to
the exciton localization. We deduce the EMP energy of 14 meV, which is in
agreement with time-integrated measurements based on selective excitation and
the magnetic field dependence of the PL circular polarization degree. The
polaron formation time of 500 ps is significantly longer than the corresponding
values reported earlier. We propose that this behavior is related to strong
self-localization of the EMP, accompanied with a squeezing of the heavy-hole
envelope wavefunction. This conclusion is also supported by the decrease of the
exciton lifetime from 600 ps to 200 - 400 ps with increasing magnetic field and
temperature.
",0,1,0,0,0,0
14,On Varieties of Ordered Automata,"  The classical Eilenberg correspondence, based on the concept of the syntactic
monoid, relates varieties of regular languages with pseudovarieties of finite
monoids. Various modifications of this correspondence appeared, with more
general classes of regular languages on one hand and classes of more complex
algebraic structures on the other hand. For example, classes of languages need
not be closed under complementation or all preimages under homomorphisms, while
monoids can be equipped with a compatible order or they can have a
distinguished set of generators. Such generalized varieties and pseudovarieties
also have natural counterparts formed by classes of finite (ordered) automata.
In this paper the previous approaches are combined. The notion of positive
$\mathcal C$-varieties of ordered semiautomata (i.e. no initial and final
states are specified) is introduced and their correspondence with positive
$\mathcal C$-varieties of languages is proved.
",1,0,0,0,0,0
15,Direct Evidence of Spontaneous Abrikosov Vortex State in Ferromagnetic Superconductor EuFe$_2$(As$_{1-x}$P$_x$)$_2$ with $x=0.21$,"  Using low-temperature Magnetic Force Microscopy (MFM) we provide direct
experimental evidence for spontaneous vortex phase (SVP) formation in
EuFe$_2$(As$_{0.79}$P$_{0.21}$)$_2$ single crystal with the superconducting
$T^{\rm 0}_{\rm SC}=23.6$~K and ferromagnetic $T_{\rm FM}\sim17.7$~K transition
temperatures. Spontaneous vortex-antivortex (V-AV) pairs are imaged in the
vicinity of $T_{\rm FM}$. Also, upon cooling cycle near $T_{\rm FM}$ we observe
the first-order transition from the short period domain structure, which
appears in the Meissner state, into the long period domain structure with
spontaneous vortices. It is the first experimental observation of this scenario
in the ferromagnetic superconductors. Low-temperature phase is characterized by
much larger domains in V-AV state and peculiar branched striped structures at
the surface, which are typical for uniaxial ferromagnets with perpendicular
magnetic anisotropy (PMA). The domain wall parameters at various temperatures
are estimated.
",0,1,0,0,0,0
16,A rank 18 Waring decomposition of $sM_{\langle 3\rangle}$ with 432 symmetries,"  The recent discovery that the exponent of matrix multiplication is determined
by the rank of the symmetrized matrix multiplication tensor has invigorated
interest in better understanding symmetrized matrix multiplication. I present
an explicit rank 18 Waring decomposition of $sM_{\langle 3\rangle}$ and
describe its symmetry group.
",0,0,1,0,0,0
17,The PdBI Arcsecond Whirlpool Survey (PAWS). The Role of Spiral Arms in Cloud and Star Formation,"  The process that leads to the formation of the bright star forming sites
observed along prominent spiral arms remains elusive. We present results of a
multi-wavelength study of a spiral arm segment in the nearby grand-design
spiral galaxy M51 that belongs to a spiral density wave and exhibits nine gas
spurs. The combined observations of the(ionized, atomic, molecular, dusty)
interstellar medium (ISM) with star formation tracers (HII regions, young
<10Myr stellar clusters) suggest (1) no variation in giant molecular cloud
(GMC) properties between arm and gas spurs, (2) gas spurs and extinction
feathers arising from the same structure with a close spatial relation between
gas spurs and ongoing/recent star formation (despite higher gas surface
densities in the spiral arm), (3) no trend in star formation age either along
the arm or along a spur, (4) evidence for strong star formation feedback in gas
spurs: (5) tentative evidence for star formation triggered by stellar feedback
for one spur, and (6) GMC associations (GMAs) being no special entities but the
result of blending of gas arm/spur cross-sections in lower resolution
observations. We conclude that there is no evidence for a coherent star
formation onset mechanism that can be solely associated to the presence of the
spiral density wave. This suggests that other (more localized) mechanisms are
important to delay star formation such that it occurs in spurs. The evidence of
star formation proceeding over several million years within individual spurs
implies that the mechanism that leads to star formation acts or is sustained
over a longer time-scale.
",0,1,0,0,0,0
18,Higher structure in the unstable Adams spectral sequence,"  We describe a variant construction of the unstable Adams spectral the
sequence for a space $Y$, associated to any free simplicial resolution of
$H^*(Y;R)$ for $R=\mathbb{F}_p$ or $\mathbb{Q}$. We use this construction to
describe the differentials and filtration in the spectral sequence in terms of
appropriate systems of higher cohomology operations.
",0,0,1,0,0,0
19,Comparing Covariate Prioritization via Matching to Machine Learning Methods for Causal Inference using Five Empirical Applications,"  When investigators seek to estimate causal effects, they often assume that
selection into treatment is based only on observed covariates. Under this
identification strategy, analysts must adjust for observed confounders. While
basic regression models have long been the dominant method of statistical
adjustment, more robust methods based on matching or weighting have become more
common. Of late, even more flexible methods based on machine learning methods
have been developed for statistical adjustment. These machine learning methods
are designed to be black box methods with little input from the researcher.
Recent research used a data competition to evaluate various methods of
statistical adjustment and found that black box methods out performed all other
methods of statistical adjustment. Matching methods with covariate
prioritization are designed for direct input from substantive investigators in
direct contrast to black methods. In this article, we use a different research
design to compare matching with covariate prioritization to black box methods.
We use black box methods to replicate results from five studies where matching
with covariate prioritization was used to customize the statistical adjustment
in direct response to substantive expertise. We find little difference across
the methods. We conclude with advice for investigators.
",0,0,0,1,0,0
20,Acoustic Impedance Calculation via Numerical Solution of the Inverse Helmholtz Problem,"  Assigning homogeneous boundary conditions, such as acoustic impedance, to the
thermoviscous wave equations (TWE) derived by transforming the linearized
Navier-Stokes equations (LNSE) to the frequency domain yields a so-called
Helmholtz solver, whose output is a discrete set of complex eigenfunction and
eigenvalue pairs. The proposed method -- the inverse Helmholtz solver (iHS) --
reverses such procedure by returning the value of acoustic impedance at one or
more unknown impedance boundaries (IBs) of a given domain via spatial
integration of the TWE for a given real-valued frequency with assigned
conditions on other boundaries. The iHS procedure is applied to a second-order
spatial discretization of the TWEs derived on an unstructured grid with
staggered grid arrangement. The momentum equation only is extended to the
center of each IB face where pressure and velocity components are co-located
and treated as unknowns. One closure condition considered for the iHS is the
assignment of the surface gradient of pressure phase over the IBs,
corresponding to assigning the shape of the acoustic waveform at the IB. The
iHS procedure is carried out independently for each frequency in order to
return the complete broadband complex impedance distribution at the IBs in any
desired frequency range. The iHS approach is first validated against Rott's
theory for both inviscid and viscous, rectangular and circular ducts. The
impedance of a geometrically complex toy cavity is then reconstructed and
verified against companion full compressible unstructured Navier-Stokes
simulations resolving the cavity geometry and one-dimensional impedance test
tube calculations based on time-domain impedance boundary conditions (TDIBC).
The iHS methodology is also shown to capture thermoacoustic effects, with
reconstructed impedance values quantitatively in agreement with thermoacoustic
growth rates.
",0,1,0,0,0,0
21,Deciphering noise amplification and reduction in open chemical reaction networks,"  The impact of random fluctuations on the dynamical behavior a complex
biological systems is a longstanding issue, whose understanding would shed
light on the evolutionary pressure that nature imposes on the intrinsic noise
levels and would allow rationally designing synthetic networks with controlled
noise. Using the Itō stochastic differential equation formalism, we performed
both analytic and numerical analyses of several model systems containing
different molecular species in contact with the environment and interacting
with each other through mass-action kinetics. These systems represent for
example biomolecular oligomerization processes, complex-breakage reactions,
signaling cascades or metabolic networks. For chemical reaction networks with
zero deficiency values, which admit a detailed- or complex-balanced steady
state, all molecular species are uncorrelated. The number of molecules of each
species follow a Poisson distribution and their Fano factors, which measure the
intrinsic noise, are equal to one. Systems with deficiency one have an
unbalanced non-equilibrium steady state and a non-zero S-flux, defined as the
flux flowing between the complexes multiplied by an adequate stoichiometric
coefficient. In this case, the noise on each species is reduced if the flux
flows from the species of lowest to highest complexity, and is amplified is the
flux goes in the opposite direction. These results are generalized to systems
of deficiency two, which possess two independent non-vanishing S-fluxes, and we
conjecture that a similar relation holds for higher deficiency systems.
",0,0,0,0,1,0
22,Many-Body Localization: Stability and Instability,"  Rare regions with weak disorder (Griffiths regions) have the potential to
spoil localization. We describe a non-perturbative construction of local
integrals of motion (LIOMs) for a weakly interacting spin chain in one
dimension, under a physically reasonable assumption on the statistics of
eigenvalues. We discuss ideas about the situation in higher dimensions, where
one can no longer ensure that interactions involving the Griffiths regions are
much smaller than the typical energy-level spacing for such regions. We argue
that ergodicity is restored in dimension d > 1, although equilibration should
be extremely slow, similar to the dynamics of glasses.
",0,1,1,0,0,0
