ID,TITLE,ABSTRACT,Computer Science,Physics,Mathematics,Statistics,Quantitative Biology,Quantitative Finance
455,Multiphase Flows of N Immiscible Incompressible Fluids: An Outflow/Open Boundary Condition and Algorithm,"  We present a set of effective outflow/open boundary conditions and an
associated algorithm for simulating the dynamics of multiphase flows consisting
of $N$ ($N\geqslant 2$) immiscible incompressible fluids in domains involving
outflows or open boundaries. These boundary conditions are devised based on the
properties of energy stability and reduction consistency. The energy stability
property ensures that the contributions of these boundary conditions to the
energy balance will not cause the total energy of the N-phase system to
increase over time. Therefore, these open/outflow boundary conditions are very
effective in overcoming the backflow instability in multiphase systems. The
reduction consistency property ensures that if some fluid components are absent
from the N-phase system then these N-phase boundary conditions will reduce to
those corresponding boundary conditions for the equivalent smaller system. Our
numerical algorithm for the proposed boundary conditions together with the
N-phase governing equations involves only the solution of a set of de-coupled
individual Helmholtz-type equations within each time step, and the resultant
linear algebraic systems after discretization involve only constant and
time-independent coefficient matrices which can be pre-computed. Therefore, the
algorithm is computationally very efficient and attractive. We present
extensive numerical experiments for flow problems involving multiple fluid
components and inflow/outflow boundaries to test the proposed method. In
particular, we compare in detail the simulation results of a three-phase
capillary wave problem with Prosperetti's exact physical solution and
demonstrate that the method developed herein produces physically accurate
results.
",0,1,0,0,0,0
456,Deadly dark matter cusps vs faint and extended star clusters: Eridanus II and Andromeda XXV,"  The recent detection of two faint and extended star clusters in the central
regions of two Local Group dwarf galaxies, Eridanus II and Andromeda XXV,
raises the question of whether clusters with such low densities can survive the
tidal field of cold dark matter haloes with central density cusps. Using both
analytic arguments and a suite of collisionless N-body simulations, I show that
these clusters are extremely fragile and quickly disrupted in the presence of
central cusps $\rho\sim r^{-\alpha}$ with $\alpha\gtrsim 0.2$. Furthermore, the
scenario in which the clusters where originally more massive and sank to the
center of the halo requires extreme fine tuning and does not naturally
reproduce the observed systems. In turn, these clusters are long lived in cored
haloes, whose central regions are safe shelters for $\alpha\lesssim 0.2$. The
only viable scenario for hosts that have preserved their primoridal cusp to the
present time is that the clusters formed at rest at the bottom of the
potential, which is easily tested by measurement of the clusters proper
velocity within the host. This offers means to readily probe the central
density profile of two dwarf galaxies as faint as $L_V\sim5\times 10^5 L_\odot$
and $L_V\sim6\times10^4 L_\odot$, in which stellar feedback is unlikely to be
effective.
",0,1,0,0,0,0
457,"Mutual Information, Relative Entropy and Estimation Error in Semi-martingale Channels","  Fundamental relations between information and estimation have been
established in the literature for the continuous-time Gaussian and Poisson
channels, in a long line of work starting from the classical representation
theorems by Duncan and Kabanov respectively. In this work, we demonstrate that
such relations hold for a much larger family of continuous-time channels. We
introduce the family of semi-martingale channels where the channel output is a
semi-martingale stochastic process, and the channel input modulates the
characteristics of the semi-martingale. For these channels, which includes as a
special case the continuous time Gaussian and Poisson models, we establish new
representations relating the mutual information between the channel input and
output to an optimal causal filtering loss, thereby unifying and considerably
extending results from the Gaussian and Poisson settings. Extensions to the
setting of mismatched estimation are also presented where the relative entropy
between the laws governing the output of the channel under two different input
distributions is equal to the cumulative difference between the estimation loss
incurred by using the mismatched and optimal causal filters respectively. The
main tool underlying these results is the Doob--Meyer decomposition of a class
of likelihood ratio sub-martingales. The results in this work can be viewed as
the continuous-time analogues of recent generalizations for relations between
information and estimation for discrete-time Lévy channels.
",1,0,0,0,0,0
458,Testing redMaPPer centring probabilities using galaxy clustering and galaxy-galaxy lensing,"  Galaxy cluster centring is a key issue for precision cosmology studies using
galaxy surveys. Mis-identification of central galaxies causes systematics in
various studies such as cluster lensing, satellite kinematics, and galaxy
clustering. The red-sequence Matched-filter Probabilistic Percolation
(redMaPPer) estimates the probability that each member galaxy is central from
photometric information rather than specifying one central galaxy. The
redMaPPer estimates can be used for calibrating the off-centring effect,
however, the centring algorithm has not previously been well-tested. We test
the centring probabilities of redMaPPer cluster catalog using the projected
cross correlation between redMaPPer clusters with photometric red galaxies and
galaxy-galaxy lensing. We focus on the subsample of redMaPPer clusters in which
the redMaPPer central galaxies (RMCGs) are not the brightest member galaxies
(BMEM) and both of them have spectroscopic redshift. This subsample represents
nearly 10% of the whole cluster sample. We find a clear difference in the
cross-correlation measurements between RMCGs and BMEMs, and the estimated
centring probability is 74$\pm$10% for RMCGs and 13$\pm$4% for BMEMs in the
Gaussian offset model and 78$\pm$9% for RMCGs and 5$\pm$5% for BMEMs in the NFW
offset model. These values are in agreement with the centring probability
values reported by redMaPPer (75% for RMCG and 10% for BMEMs) within 1$\sigma$.
Our analysis provides a strong consistency test of the redMaPPer centring
probabilities. Our results suggest that redMaPPer centring probabilities are
reliably estimated. We confirm that the brightest galaxy in the cluster is not
always the central galaxy as has been shown in previous works.
",0,1,0,0,0,0
459,Criterion of positivity for semilinear problems with applications in biology,"  The goal of this article is to provide an useful criterion of positivity and
well-posedness for a wide range of infinite dimensional semilinear abstract
Cauchy problems. This criterion is based on some weak assumptions on the
non-linear part of the semilinear problem and on the existence of a strongly
continuous semigroup generated by the differential operator. To illustrate a
large variety of applications, we exhibit the feasibility of this criterion
through three examples in mathematical biology: epidemiology, predator-prey
interactions and oncology.
",0,0,1,0,0,0
460,Axiomatic quantum mechanics: Necessity and benefits for the physics studies,"  The ongoing progress in quantum theory emphasizes the crucial role of the
very basic principles of quantum theory. However, this is not properly followed
in teaching quantum mechanics on the graduate and undergraduate levels of
physics studies. The existing textbooks typically avoid the axiomatic
presentation of the theory. We emphasize usefulness of the systematic,
axiomatic approach to the basics of quantum theory as well as its importance in
the light of the modern scientific-research context.
",0,1,0,0,0,0
461,Kinetic modelling of competition and depletion of shared miRNAs by competing endogenous RNAs,"  Non-conding RNAs play a key role in the post-transcriptional regulation of
mRNA translation and turnover in eukaryotes. miRNAs, in particular, interact
with their target RNAs through protein-mediated, sequence-specific binding,
giving rise to extended and highly heterogeneous miRNA-RNA interaction
networks. Within such networks, competition to bind miRNAs can generate an
effective positive coupling between their targets. Competing endogenous RNAs
(ceRNAs) can in turn regulate each other through miRNA-mediated crosstalk.
Albeit potentially weak, ceRNA interactions can occur both dynamically,
affecting e.g. the regulatory clock, and at stationarity, in which case ceRNA
networks as a whole can be implicated in the composition of the cell's
proteome. Many features of ceRNA interactions, including the conditions under
which they become significant, can be unraveled by mathematical and in silico
models. We review the understanding of the ceRNA effect obtained within such
frameworks, focusing on the methods employed to quantify it, its role in the
processing of gene expression noise, and how network topology can determine its
reach.
",0,0,0,0,1,0
462,Shortening binary complexes and commutativity of $K$-theory with infinite products,"  We show that in Grayson's model of higher algebraic $K$-theory using binary
acyclic complexes, the complexes of length two suffice to generate the whole
group. Moreover, we prove that the comparison map from Nenashev's model for
$K_1$ to Grayson's model for $K_1$ is an isomorphism. It follows that algebraic
$K$-theory of exact categories commutes with infinite products.
",0,0,1,0,0,0
463,Cost-Effective Seed Selection in Online Social Networks,"  We study the min-cost seed selection problem in online social networks, where
the goal is to select a set of seed nodes with the minimum total cost such that
the expected number of influenced nodes in the network exceeds a predefined
threshold. We propose several algorithms that outperform the previous studies
both on the theoretical approximation ratios and on the experimental
performance. Under the case where the nodes have heterogeneous costs, our
algorithms are the first bi- criteria approximation algorithms with polynomial
running time and provable logarithmic performance bounds using a general
contagion model. Under the case where the users have uniform costs, our
algorithms achieve logarithmic approximation ratio and provable time complexity
which is smaller than that of existing algorithms in orders of magnitude. We
conduct extensive experiments using real social networks. The experimental
results show that, our algorithms significantly outperform the existing
algorithms both on the total cost and on the running time, and also scale well
to billion-scale networks.
",1,0,0,0,0,0
464,Fast Meta-Learning for Adaptive Hierarchical Classifier Design,"  We propose a new splitting criterion for a meta-learning approach to
multiclass classifier design that adaptively merges the classes into a
tree-structured hierarchy of increasingly difficult binary classification
problems. The classification tree is constructed from empirical estimates of
the Henze-Penrose bounds on the pairwise Bayes misclassification rates that
rank the binary subproblems in terms of difficulty of classification. The
proposed empirical estimates of the Bayes error rate are computed from the
minimal spanning tree (MST) of the samples from each pair of classes. Moreover,
a meta-learning technique is presented for quantifying the one-vs-rest Bayes
error rate for each individual class from a single MST on the entire dataset.
Extensive simulations on benchmark datasets show that the proposed hierarchical
method can often be learned much faster than competing methods, while achieving
competitive accuracy.
",1,0,0,1,0,0
465,Vibrational Density Matrix Renormalization Group,"  Variational approaches for the calculation of vibrational wave functions and
energies are a natural route to obtain highly accurate results with
controllable errors. However, the unfavorable scaling and the resulting high
computational cost of standard variational approaches limit their application
to small molecules with only few vibrational modes. Here, we demonstrate how
the density matrix renormalization group (DMRG) can be exploited to optimize
vibrational wave functions (vDMRG) expressed as matrix product states. We study
the convergence of these calculations with respect to the size of the local
basis of each mode, the number of renormalized block states, and the number of
DMRG sweeps required. We demonstrate the high accuracy achieved by vDMRG for
small molecules that were intensively studied in the literature. We then
proceed to show that the complete fingerprint region of the sarcosyn-glycin
dipeptide can be calculated with vDMRG.
",0,1,0,0,0,0
466,Identification and Off-Policy Learning of Multiple Objectives Using Adaptive Clustering,"  In this work, we present a methodology that enables an agent to make
efficient use of its exploratory actions by autonomously identifying possible
objectives in its environment and learning them in parallel. The identification
of objectives is achieved using an online and unsupervised adaptive clustering
algorithm. The identified objectives are learned (at least partially) in
parallel using Q-learning. Using a simulated agent and environment, it is shown
that the converged or partially converged value function weights resulting from
off-policy learning can be used to accumulate knowledge about multiple
objectives without any additional exploration. We claim that the proposed
approach could be useful in scenarios where the objectives are initially
unknown or in real world scenarios where exploration is typically a time and
energy intensive process. The implications and possible extensions of this work
are also briefly discussed.
",1,0,0,0,0,0
467,Non-Asymptotic Analysis of Fractional Langevin Monte Carlo for Non-Convex Optimization,"  Recent studies on diffusion-based sampling methods have shown that Langevin
Monte Carlo (LMC) algorithms can be beneficial for non-convex optimization, and
rigorous theoretical guarantees have been proven for both asymptotic and
finite-time regimes. Algorithmically, LMC-based algorithms resemble the
well-known gradient descent (GD) algorithm, where the GD recursion is perturbed
by an additive Gaussian noise whose variance has a particular form. Fractional
Langevin Monte Carlo (FLMC) is a recently proposed extension of LMC, where the
Gaussian noise is replaced by a heavy-tailed {\alpha}-stable noise. As opposed
to its Gaussian counterpart, these heavy-tailed perturbations can incur large
jumps and it has been empirically demonstrated that the choice of
{\alpha}-stable noise can provide several advantages in modern machine learning
problems, both in optimization and sampling contexts. However, as opposed to
LMC, only asymptotic convergence properties of FLMC have been yet established.
In this study, we analyze the non-asymptotic behavior of FLMC for non-convex
optimization and prove finite-time bounds for its expected suboptimality. Our
results show that the weak-error of FLMC increases faster than LMC, which
suggests using smaller step-sizes in FLMC. We finally extend our results to the
case where the exact gradients are replaced by stochastic gradients and show
that similar results hold in this setting as well.
",1,0,0,1,0,0
468,Spoken English Intelligibility Remediation with PocketSphinx Alignment and Feature Extraction Improves Substantially over the State of the Art,"  We use automatic speech recognition to assess spoken English learner
pronunciation based on the authentic intelligibility of the learners' spoken
responses determined from support vector machine (SVM) classifier or deep
learning neural network model predictions of transcription correctness. Using
numeric features produced by PocketSphinx alignment mode and many recognition
passes searching for the substitution and deletion of each expected phoneme and
insertion of unexpected phonemes in sequence, the SVM models achieve 82 percent
agreement with the accuracy of Amazon Mechanical Turk crowdworker
transcriptions, up from 75 percent reported by multiple independent
researchers. Using such features with SVM classifier probability prediction
models can help computer-aided pronunciation teaching (CAPT) systems provide
intelligibility remediation.
",1,0,0,1,0,0
469,Second-Order Analysis and Numerical Approximation for Bang-Bang Bilinear Control Problems,"  We consider bilinear optimal control problems, whose objective functionals do
not depend on the controls. Hence, bang-bang solutions will appear. We
investigate sufficient second-order conditions for bang-bang controls, which
guarantee local quadratic growth of the objective functional in $L^1$. In
addition, we prove that for controls that are not bang-bang, no such growth can
be expected. Finally, we study the finite-element discretization, and prove
error estimates of bang-bang controls in $L^1$-norms.
",0,0,1,0,0,0
470,On the letter frequencies and entropy of written Marathi,"  We carry out a comprehensive analysis of letter frequencies in contemporary
written Marathi. We determine sets of letters which statistically predominate
any large generic Marathi text, and use these sets to estimate the entropy of
Marathi.
",1,0,0,0,0,0
471,Robust Orchestration of Concurrent Application Workflows in Mobile Device Clouds,"  A hybrid mobile/fixed device cloud that harnesses sensing, computing,
communication, and storage capabilities of mobile and fixed devices in the
field as well as those of computing and storage servers in remote datacenters
is envisioned. Mobile device clouds can be harnessed to enable innovative
pervasive applications that rely on real-time, in-situ processing of sensor
data collected in the field. To support concurrent mobile applications on the
device cloud, a robust and secure distributed computing framework, called
Maestro, is proposed. The key components of Maestro are (i) a task scheduling
mechanism that employs controlled task replication in addition to task
reallocation for robustness and (ii) Dedup for task deduplication among
concurrent pervasive workflows. An architecture-based solution that relies on
task categorization and authorized access to the categories of tasks is
proposed for different levels of protection. Experimental evaluation through
prototype testbed of Android- and Linux-based mobile devices as well as
simulations is performed to demonstrate Maestro's capabilities.
",1,0,0,0,0,0
472,Anisotropy and multiband superconductivity in Sr2RuO4,"  Despite numerous studies the exact nature of the order parameter in
superconducting Sr2RuO4 remains unresolved. We have extended previous
small-angle neutron scattering studies of the vortex lattice in this material
to a wider field range, higher temperatures, and with the field applied close
to both the <100> and <110> basal plane directions. Measurements at high field
were made possible by the use of both spin polarization and analysis to improve
the signal-to-noise ratio. Rotating the field towards the basal plane causes a
distortion of the square vortex lattice observed for H // <001>, and also a
symmetry change to a distorted triangular symmetry for fields close to <100>.
The vortex lattice distortion allows us to determine the intrinsic
superconducting anisotropy between the c-axis and the Ru-O basal plane,
yielding a value of ~60 at low temperature and low to intermediate fields. This
greatly exceeds the upper critical field anisotropy of ~20 at low temperature,
reminiscent of Pauli limiting. Indirect evidence for Pauli paramagnetic effects
on the unpaired quasiparticles in the vortex cores are observed, but a direct
detection lies below the measurement sensitivity. The superconducting
anisotropy is found to be independent of temperature but increases for fields >
1 T, indicating multiband superconductvity in Sr2RuO4. Finally, the temperature
dependence of the scattered intensity provides further support for gap nodes or
deep minima in the superconducting gap.
",0,1,0,0,0,0
473,"Time-Reversal Breaking in QCD$_4$, Walls, and Dualities in 2+1 Dimensions","  We study $SU(N)$ Quantum Chromodynamics (QCD) in 3+1 dimensions with $N_f$
degenerate fundamental quarks with mass $m$ and a $\theta$-parameter. For
generic $m$ and $\theta$ the theory has a single gapped vacuum. However, as
$\theta$ is varied through $\theta=\pi$ for large $m$ there is a first order
transition. For $N_f=1$ the first order transition line ends at a point with a
massless $\eta'$ particle (for all $N$) and for $N_f>1$ the first order
transition ends at $m=0$, where, depending on the value of $N_f$, the IR theory
has free Nambu-Goldstone bosons, an interacting conformal field theory, or a
free gauge theory. Even when the $4d$ bulk is smooth, domain walls and
interfaces can have interesting phase transitions separating different $3d$
phases. These turn out to be the phases of the recently studied $3d$
Chern-Simons matter theories, thus relating the dynamics of QCD$_4$ and
QCD$_3$, and, in particular, making contact with the recently discussed
dualities in 2+1 dimensions. For example, when the massless $4d$ theory has an
$SU(N_f)$ sigma model, the domain wall theory at low (nonzero) mass supports a
$3d$ massless $CP^{N_f-1}$ nonlinear $\sigma$-model with a Wess-Zumino term, in
agreement with the conjectured dynamics in 2+1 dimensions.
",0,1,0,0,0,0
474,Comparative Investigation of the High Pressure Autoignition of the Butanol Isomers,"  Investigation of the autoignition delay of the butanol isomers has been
performed at elevated pressures of 15 bar and 30 bar and low to intermediate
temperatures of 680-860 K. The reactivity of the stoichiometric isomers of
butanol, in terms of inverse ignition delay, was ranked as n-butanol >
sec-butanol ~ iso-butanol > tert-butanol at a compressed pressure of 15 bar but
changed to n-butanol > tert-butanol > sec-butanol > iso-butanol at 30 bar. For
the temperature and pressure conditions in this study, no NTC or two-stage
ignition behavior were observed. However, for both of the compressed pressures
studied in this work, tert-butanol exhibited unique pre-ignition heat release
characteristics. As such, tert-butanol was further studied at two additional
equivalence ratios ($\phi$ = 0.5 and 2.0) to help determine the cause of the
heat release.
",0,1,0,0,0,0
475,Selecting optimal minimum spanning trees that share a topological correspondence with phylogenetic trees,"  Choi et. al (2011) introduced a minimum spanning tree (MST)-based method
called CLGrouping, for constructing tree-structured probabilistic graphical
models, a statistical framework that is commonly used for inferring
phylogenetic trees. While CLGrouping works correctly if there is a unique MST,
we observe an indeterminacy in the method in the case that there are multiple
MSTs. In this work we remove this indeterminacy by introducing so-called
vertex-ranked MSTs. We note that the effectiveness of CLGrouping is inversely
related to the number of leaves in the MST. This motivates the problem of
finding a vertex-ranked MST with the minimum number of leaves (MLVRMST). We
provide a polynomial time algorithm for the MLVRMST problem, and prove its
correctness for graphs whose edges are weighted with tree-additive distances.
",1,0,1,0,0,0
476,Noisy Natural Gradient as Variational Inference,"  Variational Bayesian neural nets combine the flexibility of deep learning
with Bayesian uncertainty estimation. Unfortunately, there is a tradeoff
between cheap but simple variational families (e.g.~fully factorized) or
expensive and complicated inference procedures. We show that natural gradient
ascent with adaptive weight noise implicitly fits a variational posterior to
maximize the evidence lower bound (ELBO). This insight allows us to train
full-covariance, fully factorized, or matrix-variate Gaussian variational
posteriors using noisy versions of natural gradient, Adam, and K-FAC,
respectively, making it possible to scale up to modern-size ConvNets. On
standard regression benchmarks, our noisy K-FAC algorithm makes better
predictions and matches Hamiltonian Monte Carlo's predictive variances better
than existing methods. Its improved uncertainty estimates lead to more
efficient exploration in active learning, and intrinsic motivation for
reinforcement learning.
",1,0,0,1,0,0
477,A Game of Life on Penrose tilings,"  We define rules for cellular automata played on quasiperiodic tilings of the
plane arising from the multigrid method in such a way that these cellular
automata are isomorphic to Conway's Game of Life. Although these tilings are
nonperiodic, determining the next state of each tile is a local computation,
requiring only knowledge of the local structure of the tiling and the states of
finitely many nearby tiles. As an example, we show a version of a ""glider""
moving through a region of a Penrose tiling. This constitutes a potential
theoretical framework for a method of executing computations in
non-periodically structured substrates such as quasicrystals.
",0,1,1,0,0,0
