ID,TITLE,ABSTRACT,Computer Science,Physics,Mathematics,Statistics,Quantitative Biology,Quantitative Finance
296,Fermi acceleration of electrons inside foreshock transient cores,"  Foreshock transients upstream of Earth's bow shock have been recently
observed to accelerate electrons to many times their thermal energy. How such
acceleration occurs is unknown, however. Using THEMIS case studies, we examine
a subset of acceleration events (31 of 247 events) in foreshock transients with
cores that exhibit gradual electron energy increases accompanied by low
background magnetic field strength and large-amplitude magnetic fluctuations.
Using the evolution of electron distributions and the energy increase rates at
multiple spacecraft, we suggest that Fermi acceleration between a converging
foreshock transient's compressional boundary and the bow shock is responsible
for the observed electron acceleration. We then show that a one-dimensional
test particle simulation of an ideal Fermi acceleration model in fluctuating
fields prescribed by the observations can reproduce the observed evolution of
electron distributions, energy increase rate, and pitch-angle isotropy,
providing further support for our hypothesis. Thus, Fermi acceleration is
likely the principal electron acceleration mechanism in at least this subset of
foreshock transient cores.
",0,1,0,0,0,0
297,Quantum Speed Limit is Not Quantum,"  The quantum speed limit (QSL), or the energy-time uncertainty relation,
describes the fundamental maximum rate for quantum time evolution and has been
regarded as being unique in quantum mechanics. In this study, we obtain a
classical speed limit corresponding to the QSL using the Hilbert space for the
classical Liouville equation. Thus, classical mechanics has a fundamental speed
limit, and QSL is not a purely quantum phenomenon but a universal dynamical
property of the Hilbert space. Furthermore, we obtain similar speed limits for
the imaginary-time Schroedinger equations such as the master equation.
",0,1,0,0,0,0
298,Adaptive Diffusion Processes of Time-Varying Local Information on Networks,"  This paper mainly discusses the diffusion on complex networks with
time-varying couplings. We propose a model to describe the adaptive diffusion
process of local topological and dynamical information, and find that the
Barabasi-Albert scale-free network (BA network) is beneficial to the diffusion
and leads nodes to arrive at a larger state value than other networks do. The
ability of diffusion for a node is related to its own degree. Specifically,
nodes with smaller degrees are more likely to change their states and reach
larger values, while those with larger degrees tend to stick to their original
states. We introduce state entropy to analyze the thermodynamic mechanism of
the diffusion process, and interestingly find that this kind of diffusion
process is a minimization process of state entropy. We use the inequality
constrained optimization method to reveal the restriction function of the
minimization and find that it has the same form as the Gibbs free energy. The
thermodynamical concept allows us to understand dynamical processes on complex
networks from a brand-new perspective. The result provides a convenient means
of optimizing relevant dynamical processes on practical circuits as well as
related complex systems.
",1,0,0,0,0,0
299,ACVAE-VC: Non-parallel many-to-many voice conversion with auxiliary classifier variational autoencoder,"  This paper proposes a non-parallel many-to-many voice conversion (VC) method
using a variant of the conditional variational autoencoder (VAE) called an
auxiliary classifier VAE (ACVAE). The proposed method has three key features.
First, it adopts fully convolutional architectures to construct the encoder and
decoder networks so that the networks can learn conversion rules that capture
time dependencies in the acoustic feature sequences of source and target
speech. Second, it uses an information-theoretic regularization for the model
training to ensure that the information in the attribute class label will not
be lost in the conversion process. With regular CVAEs, the encoder and decoder
are free to ignore the attribute class label input. This can be problematic
since in such a situation, the attribute class label will have little effect on
controlling the voice characteristics of input speech at test time. Such
situations can be avoided by introducing an auxiliary classifier and training
the encoder and decoder so that the attribute classes of the decoder outputs
are correctly predicted by the classifier. Third, it avoids producing
buzzy-sounding speech at test time by simply transplanting the spectral details
of the input speech into its converted version. Subjective evaluation
experiments revealed that this simple method worked reasonably well in a
non-parallel many-to-many speaker identity conversion task.
",1,0,0,1,0,0
300,Spectral analysis of jet turbulence,"  Informed by LES data and resolvent analysis of the mean flow, we examine the
structure of turbulence in jets in the subsonic, transonic, and supersonic
regimes. Spectral (frequency-space) proper orthogonal decomposition is used to
extract energy spectra and decompose the flow into energy-ranked coherent
structures. The educed structures are generally well predicted by the resolvent
analysis. Over a range of low frequencies and the first few azimuthal mode
numbers, these jets exhibit a low-rank response characterized by
Kelvin-Helmholtz (KH) type wavepackets associated with the annular shear layer
up to the end of the potential core and that are excited by forcing in the
very-near-nozzle shear layer. These modes too the have been experimentally
observed before and predicted by quasi-parallel stability theory and other
approximations--they comprise a considerable portion of the total turbulent
energy. At still lower frequencies, particularly for the axisymmetric mode, and
again at high frequencies for all azimuthal wavenumbers, the response is not
low rank, but consists of a family of similarly amplified modes. These modes,
which are primarily active downstream of the potential core, are associated
with the Orr mechanism. They occur also as sub-dominant modes in the range of
frequencies dominated by the KH response. Our global analysis helps tie
together previous observations based on local spatial stability theory, and
explains why quasi-parallel predictions were successful at some frequencies and
azimuthal wavenumbers, but failed at others.
",0,1,0,0,0,0
301,A dual framework for low-rank tensor completion,"  One of the popular approaches for low-rank tensor completion is to use the
latent trace norm regularization. However, most existing works in this
direction learn a sparse combination of tensors. In this work, we fill this gap
by proposing a variant of the latent trace norm that helps in learning a
non-sparse combination of tensors. We develop a dual framework for solving the
low-rank tensor completion problem. We first show a novel characterization of
the dual solution space with an interesting factorization of the optimal
solution. Overall, the optimal solution is shown to lie on a Cartesian product
of Riemannian manifolds. Furthermore, we exploit the versatile Riemannian
optimization framework for proposing computationally efficient trust region
algorithm. The experiments illustrate the efficacy of the proposed algorithm on
several real-world datasets across applications.
",1,0,0,1,0,0
302,La notion d'involution dans le Brouillon Project de Girard Desargues,"  Nous tentons dans cet article de proposer une thèse cohérente concernant
la formation de la notion d'involution dans le Brouillon Project de Desargues.
Pour cela, nous donnons une analyse détaillée des dix premières pages
dudit Brouillon, comprenant les développements de cas particuliers qui aident
à comprendre l'intention de Desargues. Nous mettons cette analyse en regard
de la lecture qu'en fait Jean de Beaugrand et que l'on trouve dans les Advis
Charitables.
The purpose of this article is to propose a coherent thesis on how Girard
Desargues arrived at the notion of involution in his Brouillon Project of 1639.
To this purpose we give a detailed analysis of the ten first pages of the
Brouillon, including developments of particular cases which help to understand
the goal of Desargues, as well as to clarify the links between the notion of
involution and that of harmonic division. We compare the conclusions of this
analysis with the very critical reading Jean de Beaugrand made of the Brouillon
Project in the Advis Charitables of 1640.
",0,0,1,0,0,0
303,Framing U-Net via Deep Convolutional Framelets: Application to Sparse-view CT,"  X-ray computed tomography (CT) using sparse projection views is a recent
approach to reduce the radiation dose. However, due to the insufficient
projection views, an analytic reconstruction approach using the filtered back
projection (FBP) produces severe streaking artifacts. Recently, deep learning
approaches using large receptive field neural networks such as U-Net have
demonstrated impressive performance for sparse- view CT reconstruction.
However, theoretical justification is still lacking. Inspired by the recent
theory of deep convolutional framelets, the main goal of this paper is,
therefore, to reveal the limitation of U-Net and propose new multi-resolution
deep learning schemes. In particular, we show that the alternative U- Net
variants such as dual frame and the tight frame U-Nets satisfy the so-called
frame condition which make them better for effective recovery of high frequency
edges in sparse view- CT. Using extensive experiments with real patient data
set, we demonstrate that the new network architectures provide better
reconstruction performance.
",1,0,0,1,0,0
304,Lie $\infty$-algebroids and singular foliations,"  A singular (or Hermann) foliation on a smooth manifold $M$ can be seen as a
subsheaf of the sheaf $\mathfrak{X}$ of vector fields on $M$. We show that if
this singular foliation admits a resolution (in the sense of sheaves)
consisting of sections of a graded vector bundle of finite type, then one can
lift the Lie bracket of vector fields to a Lie $\infty$-algebroid structure on
this resolution, that we call a universal Lie $\infty$-algebroid associated to
the foliation. The name is justified because it is isomorphic (up to homotopy)
to any other Lie $\infty$-algebroid structure built on any other resolution of
the given singular foliation.
",0,0,1,0,0,0
305,Distinct evolutions of Weyl fermion quasiparticles and Fermi arcs with bulk band topology in Weyl semimetals,"  The Weyl semimetal phase is a recently discovered topological quantum state
of matter characterized by the presence of topologically protected degeneracies
near the Fermi level. These degeneracies are the source of exotic phenomena,
including the realization of chiral Weyl fermions as quasiparticles in the bulk
and the formation of Fermi arc states on the surfaces. Here, we demonstrate
that these two key signatures show distinct evolutions with the bulk band
topology by performing angle-resolved photoemission spectroscopy, supported by
first-principle calculations, on transition-metal monophosphides. While Weyl
fermion quasiparticles exist only when the chemical potential is located
between two saddle points of the Weyl cone features, the Fermi arc states
extend in a larger energy scale and are robust across the bulk Lifshitz
transitions associated with the recombination of two non-trivial Fermi surfaces
enclosing one Weyl point into a single trivial Fermi surface enclosing two Weyl
points of opposite chirality. Therefore, in some systems (e.g. NbP),
topological Fermi arc states are preserved even if Weyl fermion quasiparticles
are absent in the bulk. Our findings not only provide insight into the
relationship between the exotic physical phenomena and the intrinsic bulk band
topology in Weyl semimetals, but also resolve the apparent puzzle of the
different magneto-transport properties observed in TaAs, TaP and NbP, where the
Fermi arc states are similar.
",0,1,0,0,0,0
306,Assessing inter-modal and inter-regional dependencies in prodromal Alzheimer's disease using multimodal MRI/PET and Gaussian graphical models,"  A sequence of pathological changes takes place in Alzheimer's disease, which
can be assessed in vivo using various brain imaging methods. Currently, there
is no appropriate statistical model available that can easily integrate
multiple imaging modalities, being able to utilize the additional information
provided from the combined data. We applied Gaussian graphical models (GGMs)
for analyzing the conditional dependency networks of multimodal neuroimaging
data and assessed alterations of the network structure in mild cognitive
impairment (MCI) and Alzheimer's dementia (AD) compared to cognitively healthy
controls.
Data from N=667 subjects were obtained from the Alzheimer's Disease
Neuroimaging Initiative. Mean amyloid load (AV45-PET), glucose metabolism
(FDG-PET), and gray matter volume (MRI) was calculated for each brain region.
Separate GGMs were estimated using a Bayesian framework for the combined
multimodal data for each diagnostic category. Graph-theoretical statistics were
calculated to determine network alterations associated with disease severity.
Network measures clustering coefficient, path length and small-world
coefficient were significantly altered across diagnostic groups, with a
biphasic u-shape trajectory, i.e. increased small-world coefficient in early
MCI, intermediate values in late MCI, and decreased values in AD patients
compared to controls. In contrast, no group differences were found for
clustering coefficient and small-world coefficient when estimating conditional
dependency networks on single imaging modalities.
GGMs provide a useful methodology to analyze the conditional dependency
networks of multimodal neuroimaging data.
",0,0,0,1,1,0
307,On the economics of knowledge creation and sharing,"  This work bridges the technical concepts underlying distributed computing and
blockchain technologies with their profound socioeconomic and sociopolitical
implications, particularly on academic research and the healthcare industry.
Several examples from academia, industry, and healthcare are explored
throughout this paper. The limiting factor in contemporary life sciences
research is often funding: for example, to purchase expensive laboratory
equipment and materials, to hire skilled researchers and technicians, and to
acquire and disseminate data through established academic channels. In the case
of the U.S. healthcare system, hospitals generate massive amounts of data, only
a small minority of which is utilized to inform current and future medical
practice. Similarly, corporations too expend large amounts of money to collect,
secure and transmit data from one centralized source to another. In all three
scenarios, data moves under the traditional paradigm of centralization, in
which data is hosted and curated by individuals and organizations and of
benefit to only a small subset of people.
",1,0,0,0,0,0
308,Seismic fragility curves for structures using non-parametric representations,"  Fragility curves are commonly used in civil engineering to assess the
vulnerability of structures to earthquakes. The probability of failure
associated with a prescribed criterion (e.g. the maximal inter-storey drift of
a building exceeding a certain threshold) is represented as a function of the
intensity of the earthquake ground motion (e.g. peak ground acceleration or
spectral acceleration). The classical approach relies on assuming a lognormal
shape of the fragility curves; it is thus parametric. In this paper, we
introduce two non-parametric approaches to establish the fragility curves
without employing the above assumption, namely binned Monte Carlo simulation
and kernel density estimation. As an illustration, we compute the fragility
curves for a three-storey steel frame using a large number of synthetic ground
motions. The curves obtained with the non-parametric approaches are compared
with respective curves based on the lognormal assumption. A similar comparison
is presented for a case when a limited number of recorded ground motions is
available. It is found that the accuracy of the lognormal curves depends on the
ground motion intensity measure, the failure criterion and most importantly, on
the employed method for estimating the parameters of the lognormal shape.
",0,0,0,1,0,0
309,Metastable Markov chains: from the convergence of the trace to the convergence of the finite-dimensional distributions,"  We consider continuous-time Markov chains which display a family of wells at
the same depth. We provide sufficient conditions which entail the convergence
of the finite-dimensional distributions of the order parameter to the ones of a
finite state Markov chain. We also show that the state of the process can be
represented as a time-dependent convex combination of metastable states, each
of which is supported on one well.
",0,0,1,0,0,0
310,Construction of embedded periodic surfaces in $\mathbb{R}^n$,"  We construct embedded minimal surfaces which are $n$-periodic in
$\mathbb{R}^n$. They are new for codimension $n-2\ge 2$. We start with a Jordan
curve of edges of the $n$-dimensional cube. It bounds a Plateau minimal disk
which Schwarz reflection extends to a complete minimal surface. Studying the
group of Schwarz reflections, we can characterize those Jordan curves for which
the complete surface is embedded. For example, for $n=4$ exactly five such
Jordan curves generate embedded surfaces. Our results apply to surface classes
other than minimal as well, for instance polygonal surfaces.
",0,0,1,0,0,0
311,A System of Three Super Earths Transiting the Late K-Dwarf GJ 9827 at Thirty Parsecs,"  We report the discovery of three small transiting planets orbiting GJ 9827, a
bright (K = 7.2) nearby late K-type dwarf star. GJ 9827 hosts a $1.62\pm0.11$
$R_{\rm \oplus}$ super Earth on a 1.2 day period, a $1.269^{+0.087}_{-0.089}$
$R_{\rm \oplus}$ super Earth on a 3.6 day period, and a $2.07\pm0.14$ $R_{\rm
\oplus}$ super Earth on a 6.2 day period. The radii of the planets transiting
GJ 9827 span the transition between predominantly rocky and gaseous planets,
and GJ 9827 b and c fall in or close to the known gap in the radius
distribution of small planets between these populations. At a distance of 30
parsecs, GJ 9827 is the closest exoplanet host discovered by K2 to date, making
these planets well-suited for atmospheric studies with the upcoming James Webb
Space Telescope. The GJ 9827 system provides a valuable opportunity to
characterize interior structure and atmospheric properties of coeval planets
spanning the rocky to gaseous transition.
",0,1,0,0,0,0
312,State Sum Invariants of Three Manifolds from Spherical Multi-fusion Categories,"  We define a family of quantum invariants of closed oriented $3$-manifolds
using spherical multi-fusion categories. The state sum nature of this invariant
leads directly to $(2+1)$-dimensional topological quantum field theories
($\text{TQFT}$s), which generalize the Turaev-Viro-Barrett-Westbury
($\text{TVBW}$) $\text{TQFT}$s from spherical fusion categories. The invariant
is given as a state sum over labeled triangulations, which is mostly parallel
to, but richer than the $\text{TVBW}$ approach in that here the labels live not
only on $1$-simplices but also on $0$-simplices. It is shown that a
multi-fusion category in general cannot be a spherical fusion category in the
usual sense. Thus we introduce the concept of a spherical multi-fusion category
by imposing a weakened version of sphericity. Besides containing the
$\text{TVBW}$ theory, our construction also includes the recent higher gauge
theory $(2+1)$-$\text{TQFT}$s given by Kapustin and Thorngren, which was not
known to have a categorical origin before.
",0,1,1,0,0,0
313,Sparse Neural Networks Topologies,"  We propose Sparse Neural Network architectures that are based on random or
structured bipartite graph topologies. Sparse architectures provide compression
of the models learned and speed-ups of computations, they can also surpass
their unstructured or fully connected counterparts. As we show, even more
compact topologies of the so-called SNN (Sparse Neural Network) can be achieved
with the use of structured graphs of connections between consecutive layers of
neurons. In this paper, we investigate how the accuracy and training speed of
the models depend on the topology and sparsity of the neural network. Previous
approaches using sparcity are all based on fully connected neural network
models and create sparcity during training phase, instead we explicitly define
a sparse architectures of connections before the training. Building compact
neural network models is coherent with empirical observations showing that
there is much redundancy in learned neural network models. We show
experimentally that the accuracy of the models learned with neural networks
depends on expander-like properties of the underlying topologies such as the
spectral gap and algebraic connectivity rather than the density of the graphs
of connections.
",1,0,0,1,0,0
314,Human perception in computer vision,"  Computer vision has made remarkable progress in recent years. Deep neural
network (DNN) models optimized to identify objects in images exhibit
unprecedented task-trained accuracy and, remarkably, some generalization
ability: new visual problems can now be solved more easily based on previous
learning. Biological vision (learned in life and through evolution) is also
accurate and general-purpose. Is it possible that these different learning
regimes converge to similar problem-dependent optimal computations? We
therefore asked whether the human system-level computation of visual perception
has DNN correlates and considered several anecdotal test cases. We found that
perceptual sensitivity to image changes has DNN mid-computation correlates,
while sensitivity to segmentation, crowding and shape has DNN end-computation
correlates. Our results quantify the applicability of using DNN computation to
estimate perceptual loss, and are consistent with the fascinating theoretical
view that properties of human perception are a consequence of
architecture-independent visual learning.
",1,0,0,0,0,0
315,Analyses and estimation of certain design parameters of micro-grooved heat pipes,"  A numerical analysis of heat conduction through the cover plate of a heat
pipe is carried out to determine the temperature of the working substance,
average temperature of heating and cooling surfaces, heat spread in the
transmitter, and the heat bypass through the cover plate. Analysis has been
extended for the estimation of heat transfer requirements at the outer surface
of the con- denser under different heat load conditions using Genetic
Algorithm. This paper also presents the estimation of an average heat transfer
coefficient for the boiling and condensation of the working substance inside
the microgrooves corresponding to a known temperature of the heat source. The
equation of motion of the working fluid in the meniscus of an equilateral
triangular groove has been presented from which a new term called the minimum
surface tension required for avoiding the dry out condition is defined.
Quantitative results showing the effect of thickness of cover plate, heat load,
angle of inclination and viscosity of the working fluid on the different
aspects of the heat transfer, minimum surface tension required to avoid dry
out, velocity distribution of the liquid, and radius of liquid meniscus inside
the micro-grooves have been presented and discussed.
",0,1,0,0,0,0
316,"Merge decompositions, two-sided Krohn-Rhodes, and aperiodic pointlikes","  This paper provides short proofs of two fundamental theorems of finite
semigroup theory whose previous proofs were significantly longer, namely the
two-sided Krohn-Rhodes decomposition theorem and Henckell's aperiodic pointlike
theorem, using a new algebraic technique that we call the merge decomposition.
A prototypical application of this technique decomposes a semigroup $T$ into a
two-sided semidirect product whose components are built from two subsemigroups
$T_1,T_2$, which together generate $T$, and the subsemigroup generated by their
setwise product $T_1T_2$. In this sense we decompose $T$ by merging the
subsemigroups $T_1$ and $T_2$. More generally, our technique merges semigroup
homomorphisms from free semigroups.
",1,0,1,0,0,0
317,Deep Multimodal Image-Repurposing Detection,"  Nefarious actors on social media and other platforms often spread rumors and
falsehoods through images whose metadata (e.g., captions) have been modified to
provide visual substantiation of the rumor/falsehood. This type of modification
is referred to as image repurposing, in which often an unmanipulated image is
published along with incorrect or manipulated metadata to serve the actor's
ulterior motives. We present the Multimodal Entity Image Repurposing (MEIR)
dataset, a substantially challenging dataset over that which has been
previously available to support research into image repurposing detection. The
new dataset includes location, person, and organization manipulations on
real-world data sourced from Flickr. We also present a novel, end-to-end, deep
multimodal learning model for assessing the integrity of an image by combining
information extracted from the image with related information from a knowledge
base. The proposed method is compared against state-of-the-art techniques on
existing datasets as well as MEIR, where it outperforms existing methods across
the board, with AUC improvement up to 0.23.
",1,0,0,0,0,0
