ID,TITLE,ABSTRACT,Computer Science,Physics,Mathematics,Statistics,Quantitative Biology,Quantitative Finance
142,Interference of two co-directional exclusion processes in the presence of a static bottleneck: a biologically motivated model,"  We develope a two-species exclusion process with a distinct pair of entry and
exit sites for each species of rigid rods. The relatively slower forward
stepping of the rods in an extended bottleneck region, located in between the
two entry sites, controls the extent of interference of the co-directional flow
of the two species of rods. The relative positions of the sites of entry of the
two species of rods with respect to the location of the bottleneck are
motivated by a biological phenomenon. However, the primary focus of the study
here is to explore the effects of the interference of the flow of the two
species of rods on their spatio-temporal organization and the regulations of
this interference by the extended bottleneck. By a combination of mean-field
theory and computer simulation we calculate the flux of both species of rods
and their density profiles as well as the composite phase diagrams of the
system. If the bottleneck is sufficiently stringent some of the phases become
practically unrealizable although not ruled out on the basis of any fundamental
physical principle. Moreover the extent of suppression of flow of the
downstream entrants by the flow of the upstream entrants can also be regulated
by the strength of the bottleneck. We speculate on the possible implications of
the results in the context of the biological phenomenon that motivated the
formulation of the theoretical model.
",0,1,0,0,0,0
143,Gaussian fluctuations of Jack-deformed random Young diagrams,"  We introduce a large class of random Young diagrams which can be regarded as
a natural one-parameter deformation of some classical Young diagram ensembles;
a deformation which is related to Jack polynomials and Jack characters. We show
that each such a random Young diagram converges asymptotically to some limit
shape and that the fluctuations around the limit are asymptotically Gaussian.
",0,0,1,0,0,0
144,Revisiting (logarithmic) scaling relations using renormalization group,"  We explicitly compute the critical exponents associated with logarithmic
corrections (the so-called hatted exponents) starting from the renormalization
group equations and the mean field behavior for a wide class of models at the
upper critical behavior (for short and long range $\phi^n$-theories) and below
it. This allows us to check the scaling relations among these critical
exponents obtained by analysing the complex singularities (Lee-Yang and Fisher
zeroes) of these models. Moreover, we have obtained an explicit method to
compute the $\hat{\coppa}$ exponent [defined by $\xi\sim L (\log
L)^{\hat{\coppa}}$] and, finally, we have found a new derivation of the scaling
law associated with it.
",0,1,0,0,0,0
145,Concentration of weakly dependent Banach-valued sums and applications to statistical learning methods,"  We obtain a Bernstein-type inequality for sums of Banach-valued random
variables satisfying a weak dependence assumption of general type and under
certain smoothness assumptions of the underlying Banach norm. We use this
inequality in order to investigate in the asymptotical regime the error upper
bounds for the broad family of spectral regularization methods for reproducing
kernel decision rules, when trained on a sample coming from a $\tau-$mixing
process.
",0,0,1,1,0,0
146,Evolution of the Kondo lattice electronic structure above the transport coherence temperature,"  The temperature-dependent evolution of the Kondo lattice is a long-standing
topic of theoretical and experimental investigation and yet it lacks a truly
microscopic description of the relation of the basic $f$-$d$ hybridization
processes to the fundamental temperature scales of Kondo screening and
Fermi-liquid lattice coherence. Here, the temperature-dependence of $f$-$d$
hybridized band dispersions and Fermi-energy $f$ spectral weight in the Kondo
lattice system CeCoIn$_5$ is investigated using $f$-resonant angle-resolved
photoemission (ARPES) with sufficient detail to allow direct comparison to
first principles dynamical mean field theory (DMFT) calculations containing
full realism of crystalline electric field states. The ARPES results, for two
orthogonal (001) and (100) cleaved surfaces and three different $f$-$d$
hybridization scenarios, with additional microscopic insight provided by DMFT,
reveal $f$ participation in the Fermi surface at temperatures much higher than
the lattice coherence temperature, $T^*\approx$ 45 K, commonly believed to be
the onset for such behavior. The identification of a $T$-dependent crystalline
electric field degeneracy crossover in the DMFT theory $below$ $T^*$ is
specifically highlighted.
",0,1,0,0,0,0
147,On A Conjecture Regarding Permutations Which Destroy Arithmetic Progressions,"  Hegarty conjectured for $n\neq 2, 3, 5, 7$ that $\mathbb{Z}/n\mathbb{Z}$ has
a permutation which destroys all arithmetic progressions mod $n$. For $n\ge
n_0$, Hegarty and Martinsson demonstrated that $\mathbb{Z}/n\mathbb{Z}$ has an
arithmetic-progression destroying permutation. However $n_0\approx 1.4\times
10^{14}$ and thus resolving the conjecture in full remained out of reach of any
computational techniques. However, this paper using constructions modeled after
those used by Elkies and Swaminathan for the case of $\mathbb{Z}/p\mathbb{Z}$
with $p$ being prime, establish the conjecture in full. Furthermore our results
do not rely on the fact that it suffices to study when $n<n_0$ and thus our
results completely independent of the proof given by Hegarty and Martinsson.
",0,0,1,0,0,0
148,Inverse monoids and immersions of cell complexes,"  An immersion $f : {\mathcal D} \rightarrow \mathcal C$ between cell complexes
is a local homeomorphism onto its image that commutes with the characteristic
maps of the cell complexes. We study immersions between finite-dimensional
connected $\Delta$-complexes by replacing the fundamental group of the base
space by an appropriate inverse monoid. We show how conjugacy classes of the
closed inverse submonoids of this inverse monoid may be used to classify
connected immersions into the complex. This extends earlier results of Margolis
and Meakin for immersions between graphs and of Meakin and Szakács on
immersions into $2$-dimensional $CW$-complexes.
",0,0,1,0,0,0
149,Not even wrong: The spurious link between biodiversity and ecosystem functioning,"  Resolving the relationship between biodiversity and ecosystem functioning has
been one of the central goals of modern ecology. Early debates about the
relationship were finally resolved with the advent of a statistical
partitioning scheme that decomposed the biodiversity effect into a ""selection""
effect and a ""complementarity"" effect. We prove that both the biodiversity
effect and its statistical decomposition into selection and complementarity are
fundamentally flawed because these methods use a naïve null expectation based
on neutrality, likely leading to an overestimate of the net biodiversity
effect, and they fail to account for the nonlinear abundance-ecosystem
functioning relationships observed in nature. Furthermore, under such
nonlinearity no statistical scheme can be devised to partition the biodiversity
effects. We also present an alternative metric providing a more reasonable
estimate of biodiversity effect. Our results suggest that all studies conducted
since the early 1990s likely overestimated the positive effects of biodiversity
on ecosystem functioning.
",0,0,0,0,1,0
150,Evidence of Fraud in Brazil's Electoral Campaigns Via the Benford's Law,"  The principle of democracy is that the people govern through elected
representatives. Therefore, a democracy is healthy as long as the elected
politicians do represent the people. We have analyzed data from the Brazilian
electoral court (Tribunal Superior Eleitoral, TSE) concerning money donations
for the electoral campaigns and the election results. Our work points to two
disturbing conclusions: money is a determining factor on whether a candidate is
elected or not (as opposed to representativeness); secondly, the use of
Benford's Law to analyze the declared donations received by the parties and
electoral campaigns shows evidence of fraud in the declarations. A better term
to define Brazil's government system is what we define as chrimatocracy (govern
by money).
",1,0,0,1,0,0
151,A Berkeley View of Systems Challenges for AI,"  With the increasing commoditization of computer vision, speech recognition
and machine translation systems and the widespread deployment of learning-based
back-end technologies such as digital advertising and intelligent
infrastructures, AI (Artificial Intelligence) has moved from research labs to
production. These changes have been made possible by unprecedented levels of
data and computation, by methodological advances in machine learning, by
innovations in systems software and architectures, and by the broad
accessibility of these technologies.
The next generation of AI systems promises to accelerate these developments
and increasingly impact our lives via frequent interactions and making (often
mission-critical) decisions on our behalf, often in highly personalized
contexts. Realizing this promise, however, raises daunting challenges. In
particular, we need AI systems that make timely and safe decisions in
unpredictable environments, that are robust against sophisticated adversaries,
and that can process ever increasing amounts of data across organizations and
individuals without compromising confidentiality. These challenges will be
exacerbated by the end of the Moore's Law, which will constrain the amount of
data these technologies can store and process. In this paper, we propose
several open research directions in systems, architectures, and security that
can address these challenges and help unlock AI's potential to improve lives
and society.
",1,0,0,0,0,0
152,"Equivariant infinite loop space theory, I. The space level story","  We rework and generalize equivariant infinite loop space theory, which shows
how to construct G-spectra from G-spaces with suitable structure. There is a
naive version which gives naive G-spectra for any topological group G, but our
focus is on the construction of genuine G-spectra when G is finite.
We give new information about the Segal and operadic equivariant infinite
loop space machines, supplying many details that are missing from the
literature, and we prove by direct comparison that the two machines give
equivalent output when fed equivalent input. The proof of the corresponding
nonequivariant uniqueness theorem, due to May and Thomason, works for naive
G-spectra for general G but fails hopelessly for genuine G-spectra when G is
finite. Even in the nonequivariant case, our comparison theorem is considerably
more precise, giving a direct point-set level comparison.
We have taken the opportunity to update this general area, equivariant and
nonequivariant, giving many new proofs, filling in some gaps, and giving some
corrections to results in the literature.
",0,0,1,0,0,0
153,Arithmetic purity of strong approximation for homogeneous spaces,"  We prove that any open subset $U$ of a semi-simple simply connected
quasi-split linear algebraic group $G$ with ${codim} (G\setminus U, G)\geq 2$
over a number field satisfies strong approximation by establishing a fibration
of $G$ over a toric variety. We also prove a similar result of strong
approximation with Brauer-Manin obstruction for a partial equivariant smooth
compactification of a homogeneous space where all invertible functions are
constant and the semi-simple part of the linear algebraic group is quasi-split.
Some semi-abelian varieties of any given dimension where the complements of a
rational point do not satisfy strong approximation with Brauer-Manin
obstruction are given.
",0,0,1,0,0,0
154,Flatness results for nonlocal minimal cones and subgraphs,"  We show that nonlocal minimal cones which are non-singular subgraphs outside
the origin are necessarily halfspaces.
The proof is based on classical ideas of~\cite{DG1} and on the computation of
the linearized nonlocal mean curvature operator, which is proved to satisfy a
suitable maximum principle.
With this, we obtain new, and somehow simpler, proofs of the Bernstein-type
results for nonlocal minimal surfaces which have been recently established
in~\cite{FV}. In addition, we establish a new nonlocal Bernstein-Moser-type
result which classifies Lipschitz nonlocal minimal subgraphs outside a ball.
",0,0,1,0,0,0
155,Effective Asymptotic Formulae for Multilinear Averages of Multiplicative Functions,"  Let $f_1,\ldots,f_k : \mathbb{N} \rightarrow \mathbb{C}$ be multiplicative
functions taking values in the closed unit disc. Using an analytic approach in
the spirit of Halász' mean value theorem, we compute multidimensional
averages of the shape $$x^{-l} \sum_{\mathbf{n} \in [x]^l} \prod_{1 \leq j \leq
k} f_j(L_j(\mathbf{n}))$$ as $x \rightarrow \infty$, where $[x] := [1,x]$ and
$L_1,\ldots, L_k$ are affine linear forms that satisfy some natural conditions.
Our approach gives a new proof of a result of Frantzikinakis and Host that is
distinct from theirs, with \emph{explicit} main and error terms. \\ As an
application of our formulae, we establish a \emph{local-to-global} principle
for Gowers norms of multiplicative functions. We also compute the asymptotic
densities of the sets of integers $n$ such that a given multiplicative function
$f: \mathbb{N} \rightarrow \{-1, 1\}$ yields a fixed sign pattern of length 3
or 4 on almost all 3- and 4-term arithmetic progressions, respectively, with
first term $n$.
",0,0,1,0,0,0
156,On the apparent permeability of porous media in rarefied gas flows,"  The apparent gas permeability of the porous medium is an important parameter
in the prediction of unconventional gas production, which was first
investigated systematically by Klinkenberg in 1941 and found to increase with
the reciprocal mean gas pressure (or equivalently, the Knudsen number).
Although the underlying rarefaction effects are well-known, the reason that the
correction factor in Klinkenberg's famous equation decreases when the Knudsen
number increases has not been fully understood. Most of the studies idealize
the porous medium as a bundle of straight cylindrical tubes, however, according
to the gas kinetic theory, this only results in an increase of the correction
factor with the Knudsen number, which clearly contradicts Klinkenberg's
experimental observations. Here, by solving the Bhatnagar-Gross-Krook equation
in simplified (but not simple) porous media, we identify, for the first time,
two key factors that can explain Klinkenberg's experimental results: the
tortuous flow path and the non-unitary tangential momentum accommodation
coefficient for the gas-surface interaction. Moreover, we find that
Klinkenberg's results can only be observed when the ratio between the apparent
and intrinsic permeabilities is $\lesssim30$; at large ratios (or Knudsen
numbers) the correction factor increases with the Knudsen number. Our numerical
results could also serve as benchmarking cases to assess the accuracy of
macroscopic models and/or numerical schemes for the modeling/simulation of
rarefied gas flows in complex geometries over a wide range of gas rarefaction.
",0,1,0,0,0,0
157,Small subgraphs and their extensions in a random distance graph,"  In previous papers, threshold probabilities for the properties of a random
distance graph to contain strictly balanced graphs were found. We extend this
result to arbitrary graphs and prove that the number of copies of a strictly
balanced graph has asymptotically Poisson distribution at the threshold.
",0,0,1,0,0,0
158,Increasing the Reusability of Enforcers with Lifecycle Events,"  Runtime enforcement can be effectively used to improve the reliability of
software applications. However, it often requires the definition of ad hoc
policies and enforcement strategies, which might be expensive to identify and
implement. This paper discusses how to exploit lifecycle events to obtain
useful enforcement strategies that can be easily reused across applications,
thus reducing the cost of adoption of the runtime enforcement technology. The
paper finally sketches how this idea can be used to define libraries that can
automatically overcome problems related to applications misusing them.
",1,0,0,0,0,0
159,A Fast Interior Point Method for Atomic Norm Soft Thresholding,"  The atomic norm provides a generalization of the $\ell_1$-norm to continuous
parameter spaces. When applied as a sparse regularizer for line spectral
estimation the solution can be obtained by solving a convex optimization
problem. This problem is known as atomic norm soft thresholding (AST). It can
be cast as a semidefinite program and solved by standard methods. In the
semidefinite formulation there are $O(N^2)$ dual variables and a standard
primal-dual interior point method requires at least $O(N^6)$ flops per
iteration. That has lead researcher to consider alternating direction method of
multipliers (ADMM) for the solution of AST, but this method is still somewhat
slow for large problem sizes. To obtain a faster algorithm we reformulate AST
as a non-symmetric conic program. That has two properties of key importance to
its numerical solution: the conic formulation has only $O(N)$ dual variables
and the Toeplitz structure inherent to AST is preserved. Based on it we derive
FastAST which is a primal-dual interior point method for solving AST. Two
variants are considered with the fastest one requiring only $O(N^2)$ flops per
iteration. Extensive numerical experiments demonstrate that FastAST solves AST
significantly faster than a state-of-the-art solver based on ADMM.
",1,0,0,0,0,0
160,Optimal Experiment Design for Causal Discovery from Fixed Number of Experiments,"  We study the problem of causal structure learning over a set of random
variables when the experimenter is allowed to perform at most $M$ experiments
in a non-adaptive manner. We consider the optimal learning strategy in terms of
minimizing the portions of the structure that remains unknown given the limited
number of experiments in both Bayesian and minimax setting. We characterize the
theoretical optimal solution and propose an algorithm, which designs the
experiments efficiently in terms of time complexity. We show that for bounded
degree graphs, in the minimax case and in the Bayesian case with uniform
priors, our proposed algorithm is a $\rho$-approximation algorithm, where
$\rho$ is independent of the order of the underlying graph. Simulations on both
synthetic and real data show that the performance of our algorithm is very
close to the optimal solution.
",1,0,0,1,0,0
161,Economically Efficient Combined Plant and Controller Design Using Batch Bayesian Optimization: Mathematical Framework and Airborne Wind Energy Case Study,"  We present a novel data-driven nested optimization framework that addresses
the problem of coupling between plant and controller optimization. This
optimization strategy is tailored towards instances where a closed-form
expression for the system dynamic response is unobtainable and simulations or
experiments are necessary. Specifically, Bayesian Optimization, which is a
data-driven technique for finding the optimum of an unknown and
expensive-to-evaluate objective function, is employed to solve a nested
optimization problem. The underlying objective function is modeled by a
Gaussian Process (GP); then, Bayesian Optimization utilizes the predictive
uncertainty information from the GP to determine the best subsequent control or
plant parameters. The proposed framework differs from the majority of co-design
literature where there exists a closed-form model of the system dynamics.
Furthermore, we utilize the idea of Batch Bayesian Optimization at the plant
optimization level to generate a set of plant designs at each iteration of the
overall optimization process, recognizing that there will exist economies of
scale in running multiple experiments in each iteration of the plant design
process. We validate the proposed framework for a Buoyant Airborne Turbine
(BAT). We choose the horizontal stabilizer area, longitudinal center of mass
relative to center of buoyancy (plant parameters), and the pitch angle
set-point (controller parameter) as our decision variables. Our results
demonstrate that these plant and control parameters converge to their
respective optimal values within only a few iterations.
",1,0,0,0,0,0
162,The 10 phases of spin chains with two Ising symmetries,"  We explore the topological properties of quantum spin-1/2 chains with two
Ising symmetries. This class of models does not possess any of the symmetries
that are required to protect the Haldane phase. Nevertheless, we show that
there are 4 symmetry-protected topological phases, in addition to 6 phases that
spontaneously break one or both Ising symmetries. By mapping the model to
one-dimensional interacting fermions with particle-hole and time-reversal
symmetry, we obtain integrable parent Hamiltonians for the conventional and
topological phases of the spin model. We use these Hamiltonians to characterize
the physical properties of all 10 phases, identify their local and nonlocal
order parameters, and understand the effects of weak perturbations that respect
the Ising symmetries. Our study provides the first explicit example of a class
of spin chains with several topologically non-trivial phases, and binds
together the topological classifications of interacting bosons and fermions.
",0,1,0,0,0,0
163,Generalized subspace subcodes with application in cryptology,"  Most of the codes that have an algebraic decoding algorithm are derived from
the Reed Solomon codes. They are obtained by taking equivalent codes, for
example the generalized Reed Solomon codes, or by using the so-called subfield
subcode method, which leads to Alternant codes and Goppa codes over the
underlying prime field, or over some intermediate subfield. The main advantages
of these constructions is to preserve both the minimum distance and the
decoding algorithm of the underlying Reed Solomon code. In this paper, we
propose a generalization of the subfield subcode construction by introducing
the notion of subspace subcodes and a generalization of the equivalence of
codes which leads to the notion of generalized subspace subcodes. When the
dimension of the selected subspaces is equal to one, we show that our approach
gives exactly the family of the codes obtained by equivalence and subfield
subcode technique. However, our approach highlights the links between the
subfield subcode of a code defined over an extension field and the operation of
puncturing the $q$-ary image of this code. When the dimension of the subspaces
is greater than one, we obtain codes whose alphabet is no longer a finite
field, but a set of r-uples. We explain why these codes are practically as
efficient for applications as the codes defined on an extension of degree r. In
addition, they make it possible to obtain decodable codes over a large alphabet
having parameters previously inaccessible. As an application, we give some
examples that can be used in public key cryptosystems such as McEliece.
",1,0,0,0,0,0
164,Lagrangian fibers of Gelfand-Cetlin systems,"  Motivated by the study of Nishinou-Nohara-Ueda on the Floer thoery of
Gelfand-Cetlin systems over complex partial flag manifolds, we provide a
complete description of the topology of Gelfand-Cetlin fibers. We prove that
all fibers are \emph{smooth} isotropic submanifolds and give a complete
description of the fiber to be Lagrangian in terms of combinatorics of
Gelfand-Cetlin polytope. Then we study (non-)displaceability of Lagrangian
fibers. After a few combinatorial and numercal tests for the displaceability,
using the bulk-deformation of Floer cohomology by Schubert cycles, we prove
that every full flag manifold $\mathcal{F}(n)$ ($n \geq 3$) with a monotone
Kirillov-Kostant-Souriau symplectic form carries a continuum of
non-displaceable Lagrangian tori which degenerates to a non-torus fiber in the
Hausdorff limit. In particular, the Lagrangian $S^3$-fiber in $\mathcal{F}(3)$
is non-displaceable the question of which was raised by Nohara-Ueda who
computed its Floer cohomology to be vanishing.
",0,0,1,0,0,0
